[
  {
    "url": "https://selcrs.nsysu.edu.tw/menu5/showoutline.asp?CrsDat=TEST101",
    "change": null,
    "changeDescription": null,
    "multipleCompulsory": false,
    "department": "測試學系",
    "id": "TEST101",
    "grade": "1",
    "class": "不分班",
    "name": "測試課程一\nTEST COURSE ONE",
    "credit": "3",
    "yearSemester": "期",
    "compulsory": true,
    "restrict": 50,
    "select": 10,
    "selected": 8,
    "remaining": 42,
    "teacher": "測試教師",
    "room": "一1,2(測試教室)",
    "classTime": ["12", "", "", "", "", "", ""],
    "description": "測試資料",
    "tags": [],
    "english": false
  },
  {
    "url": "https://selcrs.nsysu.edu.tw/menu5/showoutline.asp?CrsDat=TEST102",
    "change": null,
    "changeDescription": null,
    "multipleCompulsory": false,
    "department": "測試學系",
    "id": "TEST102",
    "grade": "2",
    "class": "A",
    "name": "測試課程二\nTEST COURSE TWO",
    "credit": "2",
    "yearSemester": "期",
    "compulsory": false,
    "restrict": 40,
    "select": 5,
    "selected": 4,
    "remaining": 36,
    "teacher": "第二教師",
    "room": "二3,4(測試教室)",
    "classTime": ["", "34", "", "", "", "", ""],
    "description": "測試資料",
    "tags": ["測試標籤"],
    "english": true
  },
  {
    "url": "https://selcrs.nsysu.edu.tw/menu5/showoutline.asp?CrsDat=TEST103",
    "change": "異動",
    "changeDescription": "更換教室",
    "multipleCompulsory": false,
    "department": "另一學系",
    "id": "TEST103",
    "grade": "0",
    "class": null,
    "name": "測試課程三\nTEST COURSE THREE",
    "credit": "1",
    "yearSemester": "期",
    "compulsory": false,
    "restrict": 30,
    "select": 2,
    "selected": 1,
    "remaining": 29,
    "teacher": "第三教師",
    "room": "三5(測試教室)",
    "classTime": ["", "", "5", "", "", "", ""],
    "description": "測試資料",
    "tags": [],
    "english": false
  }
]

